,discussion_topic_title,discussion_topic_message,upvotes,thread_ref_link
514,"AskScience AMA Series: I'm Alison Van Eenennaam, a researcher in animal genetics in the Department of Animal Science at the University of California, Davis. I'm here to answer questions about genome editing and its potential to bring useful genetic variants into agricultural breeding programs. AMA!","Hi Reddit, I am Alison Van Eenennaam. I just published a paper in Nature Biotechnology entitled ""[Genomic and phenotypic analyses of six offspring of a genome-edited hornless bull](https://www.nature.com/articles/s41587-019-0266-0)"". For the past two years, my laboratory and collaborators have been studying six offspring of a dairy bull, genome-edited to prevent it from growing horns. This technology has been proposed as an alternative to dehorning, a common management practice performed to protect other cattle and human handlers from injuries. We found that none of the bull's offspring developed horns, as expected, and blood work and physical exams of the calves found they were all healthy. We also sequenced the genomes of the calves and their parents and analyzed these genomic sequences. Our study found that two calves inherited the naturally-occurring hornless allele, and four calves additionally inherited a fragment of bacterial DNA, known as a plasmid. This study has generated some media interest, and I am here to answer questions about the study, and genome editing more generally.

On a personal note I'm originally from Australia where I completed a Bachelor of Agricultural Science at The University of Melbourne, before completing my Masters and Ph.D. in Genetics at UC Davis. I have now lived in California for over 30 years with my husband who is a reproductive biologist studying white sturgeon. We are therefore ""surf and turf"", and also parents of two college-age boys.  The website for my research is https://animalbiotech.ucdavis.edu/. You can follow me on Twitter @BioBeef.

I'll be online at 11am Pacific Time (2PM ET, 18 UT) on Friday October 11 to answer your questions. AMA!

-----

Dr. Alison Van Eenennaam is a Cooperative Extension Specialist in the field of Animal Genomics and Biotechnology in the Department of Animal Science at University of California, Davis. She received a Bachelor of Agricultural Science from the University of Melbourne in Australia, and both an MS in Animal Science, and a PhD in Genetics from UC Davis. Her publicly-funded research and outreach program focuses on the use of animal genomics and biotechnology in livestock production systems. Her current research projects include the development of genome editing approaches for cattle. She has given over 600 invited presentations to audiences globally, and uses a variety of media to inform general public audiences about science and technology. She serves as the bovine genome coordinator for the USDA National Animal Genome Research Program, was a member of the National Academies of Sciences, Engineering and Medicine (NASEM) Study Committee for ""Science Breakthroughs 2030: A Strategy for Food and Agricultural Research"", and is an elected Fellow and current chair of the American Association for the Advancement of Science (AAAS) Agriculture, Food, and Renewable Resources Section. A passionate advocate of science, Dr. Van Eenennaam was the recipient of the 2010 Association of Public and Land-grant Universities (APLU) National Award for Excellence in Extension, 2014 Council for Agricultural Science and Technology (CAST) Borlaug Communication Award, and the American Society of Animal Science 2019 Rockefeller Prentice Award in Animal Breeding and Genetics.",2249,https://www.reddit.com/r/askscience/comments/dgdihi/askscience_ama_series_im_alison_van_eenennaam_a/
515,"Do babies inherit disease immunity from their parents, or does each baby need to develop their own immunities individually?","I was thinking about how if we were able to snatch a newborn baby out of say, 300 BCE and raised it in the modern era, it would probably not know the difference i.e. fully adapt to modern culture and technology. Then I had the thought of diseases and whatnot, and if the time travelling baby would be more vulnerable to modern diseases than a baby that was born today, or if both babies would have equal challenge avoiding modern diseases.

I hope that all makes sense (to some degree anyways).",6,https://www.reddit.com/r/askscience/comments/dgxgg5/do_babies_inherit_disease_immunity_from_their/
516,Why is fusion energy so challenging to achieve?,,17,https://www.reddit.com/r/askscience/comments/dgtsyq/why_is_fusion_energy_so_challenging_to_achieve/
517,How can I calculate the strength of a material in reference to sealing an internal vacuum from external air pressure?,"Young's modulus seems to be a good bet, but I'm not an engineer and I don't quite know how to google this or how to use it. All of the things I can find about pressure calculations are more concerned about keeping internal pressure from escaping.",0,https://www.reddit.com/r/askscience/comments/dh3hdy/how_can_i_calculate_the_strength_of_a_material_in/
518,"Medically, how does mindful breathing/box breathing reduce anxiety?",,4,https://www.reddit.com/r/askscience/comments/dgx8h9/medically_how_does_mindful_breathingbox_breathing/
519,Does oil diffuse in water?,"I know ‘diffuse’ might not be the right term, but if you mix two liquids, they would eventualy diffuse into one. If you put oil in a hydrophobic liquid, what determines the way the oil would move or “diffuse”?. As in would it go to the sides, clump up in the middle or something else? And why?",0,https://www.reddit.com/r/askscience/comments/dh2xwe/does_oil_diffuse_in_water/
520,Can the decay half-life of a substance be affected by temperature?,"I had the idea when reading in a thread about carbon dating frozen mummies, and was curious if those dates were accurate and if they could have actually been older due to slower decay. After reading a bit on what affects random radioactive decay I concluded: not likely. I doubt the temperatures able to be reached on earth could change the decay at all. After this I was asking myself if a body were put into space and it’s mummified remains were discovered some thousands of years later could they effectively use carbon dating? Or would the near absolute zero temperature slow down the random decay of C-14. 

After reading more on carbon dating and seeing that it is formed by bombarding cosmic rays, I got to wondering if being unshielded in space would result in more C-14 isotopes forming in the mummy? So could this mummy actually appear younger than it is due to excess C-14 formation as well as external temperature affecting the decay of its native C-14?",2,https://www.reddit.com/r/askscience/comments/dgw7n4/can_the_decay_halflife_of_a_substance_be_affected/
521,Will a photon travel endlessly inside a fiber optic cable connected at its ends(in a circle)?,"And will it cross paths with itself, since the cable is less than 1 ly in lenght and the photon travels at 1ly speed?",12,https://www.reddit.com/r/askscience/comments/dgss8z/will_a_photon_travel_endlessly_inside_a_fiber/
522,How would my brain adapt to losing my hearing in one ear?,"I lost my hearing in my left ear due to sensorial hearing loss a year ago. I remember from one of my neuroscience classes that when they cut off an ape’s finger, the cells in the brain that were responsible for that finger changed to the neighboring fingers.  I wonder if the neighboring cells are for my right ear, because I have gotten a lot more used to hearing with one ear than when I first lost it a year ago.",9,https://www.reddit.com/r/askscience/comments/dgtnhg/how_would_my_brain_adapt_to_losing_my_hearing_in/
523,Why are SAR satellites put in a retrograde orbit?,"Was reading about radar reconnaissance satellite on Wikipedia. The article claims SAR satellites are usually put i' a retrograde orbit, why is that?
I understand the advantages of a polar orbit but not of a retrograde orbit.

Not sure about the flair, seems to be more engineering to me.",6,https://www.reddit.com/r/askscience/comments/dgtn61/why_are_sar_satellites_put_in_a_retrograde_orbit/
524,Is it possible to isolate the particles of a virtual particle pair?,,1413,https://www.reddit.com/r/askscience/comments/dga9lf/is_it_possible_to_isolate_the_particles_of_a/
525,What brings about glacial periods?,,5,https://www.reddit.com/r/askscience/comments/dgts61/what_brings_about_glacial_periods/
526,How can a plant grow up out from concrete ?,"We have all ever seen a tiny plant poked out from a material like concrete, brick or else. How is this possible with no ground or water other than rain ?",7,https://www.reddit.com/r/askscience/comments/dgtkjw/how_can_a_plant_grow_up_out_from_concrete/
527,"Does evapotranspiration leads to cloud formation? And to another extend, do forests generate clouds?",,8,https://www.reddit.com/r/askscience/comments/dgs8qx/does_evapotranspiration_leads_to_cloud_formation/
528,Why does a bag of chips pop in an airplane after take off while gaining altitude?,We were on a flight and had a sealed bag of chips. As we were gaining altitude it suddenly popped.  I guess it has something to do with altitude and the compressed air in the bag but how exactly does it work?,7,https://www.reddit.com/r/askscience/comments/dgsst5/why_does_a_bag_of_chips_pop_in_an_airplane_after/
529,Has a formula to obtain prime numbers be found and what applications do prime numbers have in the modern world?,,4,https://www.reddit.com/r/askscience/comments/dgtkap/has_a_formula_to_obtain_prime_numbers_be_found/
530,Why are fuzzy things generally warmer than silkier things?,"Like, I've had comforters that were more of a polyester blend, and it seems like sleeping with a fluffy throw blanket makes me warmer even though it's thinner. Is this just a psychological thing? If not, what's the cause of it on a biological level?",2,https://www.reddit.com/r/askscience/comments/dgugjj/why_are_fuzzy_things_generally_warmer_than/
531,Why is static friction greater than kinetic friction?,,11,https://www.reddit.com/r/askscience/comments/dgox7i/why_is_static_friction_greater_than_kinetic/
532,Is it possible to excite a phosphorescent material with friction?,,5,https://www.reddit.com/r/askscience/comments/dgr2gt/is_it_possible_to_excite_a_phosphorescent/
533,"If you place a tree that normally experiences seasons in an artificial environment without seasonal temperature changes, will it keep its leave year round? Will this be detrimental to it?",,18,https://www.reddit.com/r/askscience/comments/dgmaog/if_you_place_a_tree_that_normally_experiences/
534,Do stars other than our sun get sunspots?,I know this seems like an easily googleable question but I didn't really find anything when I did google it.,3,https://www.reddit.com/r/askscience/comments/dgr8z1/do_stars_other_than_our_sun_get_sunspots/
535,Is there a correlation between thermal conductivity and whether a material burns or melts?,"Is there a correlation of the conductivity of heat of a material and whether that material would burn or melt under heat?

Glass and metal both conduct heat well and melt under heat.

Wood and cloth both conduct heat poorly and burn with heat.

If you stuck the end ofmetal rod and a wood stick of the same size in a fire that could melt the metal. The metal would melt and the heat would burn. But the temperatures of the handle outside the fire would be very different.

Is there some sort of correlation between thermal conductivity and whether or not a material would burn or melt?",4,https://www.reddit.com/r/askscience/comments/dgqciq/is_there_a_correlation_between_thermal/
536,Why do people vomit in extreme pain?,"I want to know why is when someone is in extreme pain for example someone who got shot by a gun, why is one of the body’s responses to this to just vomit as opposed to other things it could do?",7,https://www.reddit.com/r/askscience/comments/dgnryf/why_do_people_vomit_in_extreme_pain/
537,"Why do strong sensory stimuli (e.g. pain, bright lights) seem to pulse?",,5,https://www.reddit.com/r/askscience/comments/dgp96g/why_do_strong_sensory_stimuli_eg_pain_bright/
538,Do any animals exhibit camouflage outside the visible spectrum?,,8,https://www.reddit.com/r/askscience/comments/dgmibx/do_any_animals_exhibit_camouflage_outside_the/
539,Why are lower metallicity stars much bigger than higher metallicity stars?,I know that mass depends on metallicity somewhat. I know that if a gas cloud has heavier elements it forms smaller stars and if it has no heavy elements it forms massive stars. But why does a cloud's metallicity affect the star's mass?,5,https://www.reddit.com/r/askscience/comments/dgowtj/why_are_lower_metallicity_stars_much_bigger_than/
540,What mechanism allows the heart to always develop on the left side of the body and not the right?,"I assume the fertilised egg is essentially bi-latterly symmetrical, as is the early blastocyst and embryo. When non-mirrored features appear and how can the embryo control whether they occur on the right or the left. Sorry for the crappy phrasing, but essentially how does the developing embryo 'know' which is the left and right side of the body?",41,https://www.reddit.com/r/askscience/comments/dgf3ue/what_mechanism_allows_the_heart_to_always_develop/
541,The universe is more than 13 billion years old. But what did it look like when it was only a year old?,Lets say we were to send an indestructible camera back in time a couple billion years in order to take some pictures/video of the universe as it looked exactly one year after the Big Bang. What could we expect to see? What about after ten years? A hundred? A thousand? A million? How long would it take the universe to start looking like it does now?,38,https://www.reddit.com/r/askscience/comments/dgelof/the_universe_is_more_than_13_billion_years_old/
542,"We are scientists from the Society of Vertebrate Paleontology coming to you from our annual meeting in Brisbane, Australia. We study fossils. Ask Us Anything!","**Edit: We are signing off! Thanks so much for all the amazing questions!**

Hello AskScience! We are members of the [**Society of Vertebrate Paleontology**](http://vertpaleo.org/). We study fossil fish, mammals, amphibians, and reptiles — anything with a backbone! Our research includes how these organisms lived, how they were affected by environmental change like a changing climate, how they're related, and much more. You can learn more about SVP in [this video](http://vertpaleo.org/The-Society/We-Are-SVP.aspx) or **follow us on Twitter @SVP_vertpaleo**.

Joining us today are:

- **Stephanie Drumheller, Ph.D.** (/u/UglyFossils) is a paleontologist at the University of Tennessee whose research focuses on the processes of fossilization, evolution, and biology, of crocodiles and their relatives, including identifying bite marks on fossils. Find her on Twitter @UglyFossils.

- **Larisa DeSantis, Ph.D.** is an Associate Professor in Biological Sciences and Earth and Environmental Sciences at Vanderbilt University. Her research focuses on the paleoecology and paleobiology of mammals in North America and Australia.

- **Dana Ehret, Ph.D.** is the Assistant Curator of Natural History at the New Jersey State Museum. He studies fossil fish and reptiles, and also has an interest in the pop culture and history of cryptids. Find him on Twitter @DrDanaEhret.

- **Jess Miller-Camp, Ph.D.** (/u/DeadGators) is the Paleontology and Zooarchaeology Collections Manager at the University of Indiana, Bloomington. Jess studies alligatorine systematics, biogeography, ecomorphology, and diversity dynamics as well as dicynodont morphology and extinction survival. Find her on Twitter @DeadGators.

- **Kenny Travouillon, Ph.D.** (/u/KTravouillon) is the Curator of Mammals at the Western Australian Museum. His expertise is in mammalian ecology and paleontology in Australia, with a focus on bandicoots.

**We are coming to you from Brisbane, Australia, so we will be back later this evening (Eastern Time) to answer your questions. Thanks for your patience, and see you soon!**",3530,https://www.reddit.com/r/askscience/comments/dfwv71/we_are_scientists_from_the_society_of_vertebrate/
543,Are there any studies that look into the lifespan of individuals in the different social classes?,,3,https://www.reddit.com/r/askscience/comments/dgnntp/are_there_any_studies_that_look_into_the_lifespan/
544,Do flu shots from previous years still protect me against those strains of the flu?,I've been getting flu shots regularly for about 25 years. Do flu shots from years ago still offer me some protection against the strains that I've been previously vaccinated against?,4,https://www.reddit.com/r/askscience/comments/dgmjg5/do_flu_shots_from_previous_years_still_protect_me/
545,"Given equal sample sizes of arterial vs. venous blood drawn at the same time, is there a reason why one sample size would clot faster than the other?",,2,https://www.reddit.com/r/askscience/comments/dgp0kh/given_equal_sample_sizes_of_arterial_vs_venous/
546,"Is a vacuum cleaner's ""sucking power"" limited to the atmospheric pressure around it?","I feel like all a vacuum does is create an empty space by pushing air, and the ""sucking"" that happens at the end is just the weight of the atmosphere pushing air into the vacuum. So can a vacuum cleaner's suction only be so strong? I see some vacuums advertise high horsepower, but is there a limit to how much horsepower actually helps the vacuum? If i had a million horse power vacuum that spun way faster than a normal vacuum, would they both still have roughly the same suction, because that's dictated by air pressure?",13,https://www.reddit.com/r/askscience/comments/dgf21c/is_a_vacuum_cleaners_sucking_power_limited_to_the/
547,What technology exists to make sure there no nation wide power outages?,,0,https://www.reddit.com/r/askscience/comments/dgq0x1/what_technology_exists_to_make_sure_there_no/
548,"How Do Propagation of Action Potentials, and Automaticity Work?","Just wanting to check my understanding to see if I'm in the ballpark of the correct answers.

So, how does propagation of action potentials work? Is it when the initial cell depolarizes, the K+ in the ECF causes an increase in membrane potential of the adjacent cell, which causes Na+ to go into the ICF of that cell? If so, why wouldn't the time-sensitive Na+ inactivation gates close, similar to hyperkalemia? I guess I'm just not sure how prolonged depolarization has to be in order to shut the gates. I'm pretty sure it's only a fraction of a second, so why wouldn't they close in this case?

Also, how does automaticity work? Since there are no EPSPs or IPSPs giving the initial stimulation, what is? I read that there are less inward rectifier K+ channels, so the potential never returns to the negative charge needed for fast Na+ channels to become active, so would this mean that it's simply the leakage of Na+ through the slow channels that bump it up to the \~ -55mV needed to open up the calcium channels? If so, why is this called ""spontaneous,"" especially if there's a steady beat, all else equal?

As a bonus, I'd love to know how exactly the action potential cycle actually causes contraction. I get that it does, but how?",3,https://www.reddit.com/r/askscience/comments/dgl608/how_do_propagation_of_action_potentials_and/
549,So how do liver transplants work?,"To my knowledge livers aren't like most organs. They're just a mass of a specific type of cell rather than an actual structured thing like most organs, and that is why it is able to regenerate so well. So how does a liver transplant work then? What bits do they connect to what and all that?",2,https://www.reddit.com/r/askscience/comments/dgmb7l/so_how_do_liver_transplants_work/
550,How do I explain to a FLAT EARTHER friend that gravity exists and what we experience is not just an effect of density?,So I have a friend who is a flat earther and he believes that gravity does not exist and what we experience is due to only density I have tried to explain to him that density is not a force but he does not understand or believe me. What else can I do to help him believe in gravity.,11,https://www.reddit.com/r/askscience/comments/dgeepe/how_do_i_explain_to_a_flat_earther_friend_that/
551,What happens to amputees who had eczema on the amputated area beforehand?,"I have eczema that manifests on my knuckles and fingers and I’ve always wondered, if someone who had eczema on their hands for example lost a hand in an accident or something, would they essentially no longer have eczema in a practical sense, or would it manifest somewhere else?",1,https://www.reddit.com/r/askscience/comments/dgof1u/what_happens_to_amputees_who_had_eczema_on_the/
552,The most wanted man in France was just arrested in Scotland thanks to fingerprint matching at the airport. How is that possible? Does it not require enormous computational power?,"So Xavier Dupont de Ligonnès, the most wanted man in France (presumed killer, etc) was just arrested in Glasgow airport under a fake name because they matched his fingerprints with the killer's (already on Interpol's red list).


I was wondering: how the heck is that possible? Does it mean that for each passenger of every flight, they match their fingerprints against an existing database? 

Would this not require a gigantic power? Fingerprint matching is basically image recognition, isn't it? That would mean matching thousands of pictures, one against one, on the daily?",2,https://www.reddit.com/r/askscience/comments/dgl4gj/the_most_wanted_man_in_france_was_just_arrested/
553,How/why do neon signs do this?," [This](https://www.reddit.com/r/woahdude/comments/dg7xpp/the_neon_at_my_local_brewery_does_this/?utm_source=share&utm_medium=ios_app&utm_name=iossmf) (I tried to crosspost but couldn’t figure it out haha sorry) At first I thought it was a trick of the camera, but would love to know what the science behind it is! 🧬",10,https://www.reddit.com/r/askscience/comments/dge0gi/howwhy_do_neon_signs_do_this/
554,Is there a causal link between the forward progression of time and the outward expansion of the universe?,"Relativity has shown us that space and time are vitally linked and more accurately described as spacetime. The universe continues to constantly expand in a determined direction (I just mean outwardly) while time flows only in a forward direction. I know Gen Relativity predicts an expanding universe, but I would be interested to know what research has been done on the estimated rate of expansion, the forward rate of time, and whether there is a causal connection between their unidirectional flows. 

I guess it could be easier to ask if there are any models that predict a backwards progression of time with a contracting universe.",5,https://www.reddit.com/r/askscience/comments/dgf4gc/is_there_a_causal_link_between_the_forward/
555,Are there convection currents in boiling water?,And where do the bubbles in boiling water come from? The bottom or from the middle?,5,https://www.reddit.com/r/askscience/comments/dgg02p/are_there_convection_currents_in_boiling_water/
556,What is the significance of the magnetic north pole?,"If I understand correctly, geographic poles decide where the equator lies, and the way the earth spins. If these poles where to change the effects would be drastic: some parts of the planet would get far more sunlight while others would get far less.

Now, if the magnetic poles would change drastically, would we notice? Basically the question comes down to *what are the effects of magnetic poles, why do they matter?*",4,https://www.reddit.com/r/askscience/comments/dgfbwc/what_is_the_significance_of_the_magnetic_north/
557,Is there a maximum possible magnetic flux density?,,3,https://www.reddit.com/r/askscience/comments/dgfxp9/is_there_a_maximum_possible_magnetic_flux_density/
558,"Why does the color of the sky get lighter, the closer it is to the horizon?",,2423,https://www.reddit.com/r/askscience/comments/dfqxuo/why_does_the_color_of_the_sky_get_lighter_the/
559,"Can CRISPR be used to replicate HeLa cells in living humans, and/or to what effect?",,2,https://www.reddit.com/r/askscience/comments/dgff6g/can_crispr_be_used_to_replicate_hela_cells_in/
560,Why can objects only travel at light speed in a vacuum. Theoretically shouldn't they just be able to accelerate to much higher than that? Photons especially have no weight so why are they limited to 300000 km/s.,I apologize in advance if this is a stupid question.,117,https://www.reddit.com/r/askscience/comments/dfzgt2/why_can_objects_only_travel_at_light_speed_in_a/
561,What does it mean when a paper states a protein with a range of numbers in brackets or on the side?,"So I’m reading a paper and the other forms of the protein appear like this

IL-339 (95–270) and IL-33 (109–270)

I know that it’s a different form of the protein but what do the numbers mean?

I think it’s in relation to SDS",5,https://www.reddit.com/r/askscience/comments/dgc8w6/what_does_it_mean_when_a_paper_states_a_protein/
