,discussion_topic_title,discussion_topic_message,upvotes,thread_ref_link
251,How is it that we know the shapes of the continents from hundreds of millions of years ago?,,43,https://www.reddit.com/r/askscience/comments/dm41zk/how_is_it_that_we_know_the_shapes_of_the/
252,Why should a comet have a “tail” at all? There’s no air friction. What’s making it break apart??,,10,https://www.reddit.com/r/askscience/comments/dm9n9r/why_should_a_comet_have_a_tail_at_all_theres_no/
253,Does makeup get absorbed into skin/bloodstream?,"Does cosmetics, makeup, anything you put on your skin or hair (including shampoo, condition, lotion, etc) get absorbed into your bloodstream? Is there any concrete proof that it occurs?",25,https://www.reddit.com/r/askscience/comments/dm3xir/does_makeup_get_absorbed_into_skinbloodstream/
254,"If climate change is a serious threat and sea levels are going to rise or are rising, why don’t we see real-estate prices drastically decreasing around coastal areas?",,22533,https://www.reddit.com/r/askscience/comments/dlh4kv/if_climate_change_is_a_serious_threat_and_sea/
255,Why do Diet/Zero drinks always have sodium?,"Everytime I see a drink that is promoted as being diet or zero calorie, it has zero grams of everything except for sodium. Why is sodium the only piece of nutrition in these drinks?",8,https://www.reddit.com/r/askscience/comments/dm5lhs/why_do_dietzero_drinks_always_have_sodium/
256,What geological event would cause this land formation?,"https://imgur.com/gallery/u2WXcyC

To me, it looks like an old volcano blew and spilled magma out, whatever it is, it looks really cool. I'm having trouble googling an answer.",14,https://www.reddit.com/r/askscience/comments/dm3xgd/what_geological_event_would_cause_this_land/
257,Why/how do fallen leaves stain the sidewalk during autumn?,,5,https://www.reddit.com/r/askscience/comments/dm7sec/whyhow_do_fallen_leaves_stain_the_sidewalk_during/
258,Why are planets always round? (Not a flat earther at all here btw) just wondering why a planets are not a more random shape?,,107,https://www.reddit.com/r/askscience/comments/dlv5la/why_are_planets_always_round_not_a_flat_earther/
259,Can a pathogen be non biological?,"Ok so my immunology professor said ""pathogens are only micro organism and hypoxia or any non biological can't be a pathogen"" 
But the other day my pathology prof said ""anything that can cause harm to a cell is a pathogen"" he also argued that the name itself validate what he said 
So i went and checked my text book and it didn't really helped cause it kept saying biological pathogens which we can conclude there is a non biological kind aswell 
If u know the answer pls tell me and mention a reference  thank you 

Also my English is not so good im sorry if i made too many mistakes",10,https://www.reddit.com/r/askscience/comments/dm3ucb/can_a_pathogen_be_non_biological/
260,"Both Google and IBM are developing quantum computers, and both are using a 53 qubit architecture. Is this a coincidence, or does that number mean something? In traditional computing, it only makes sense to use architectures with the number of bits as a power of 2, so why use a prime number?",,27,https://www.reddit.com/r/askscience/comments/dlybvw/both_google_and_ibm_are_developing_quantum/
261,Why are computers so slow at switching displays?,"While nearly every task on computers has gotten quicker and quicker, plugging into a display even on my new MacBook Pro, causes the computer to spaz out for a solid 30 seconds with windows slowly resizing, jumping around, etc., until eventually settling down and functioning normally.  Why does this process take so long, and why has it seemingly not benefited from vast improvements to bus speeds, processor speeds, etc.?",3,https://www.reddit.com/r/askscience/comments/dm9j1k/why_are_computers_so_slow_at_switching_displays/
262,"Ask Anything Wednesday - Engineering, Mathematics, Computer Science","Welcome to our weekly feature, Ask Anything Wednesday - this week we are focusing on **Engineering, Mathematics, Computer Science**

Do you have a question within these topics you weren't sure was worth submitting? Is something a bit too speculative for a typical /r/AskScience post? No question is too big or small for AAW. In this thread you can ask any science-related question! Things like: ""What would happen if..."", ""How will the future..."", ""If all the rules for 'X' were different..."", ""Why does my..."".

**Asking Questions:**

Please post your question as a top-level response to this, and our team of panellists will be here to answer and discuss your questions.

The other topic areas will appear in future Ask Anything Wednesdays, so if you have other questions not covered by this weeks theme please either hold on to it until those topics come around, or go and post over in our sister subreddit /r/AskScienceDiscussion , where every day is Ask Anything Wednesday! Off-theme questions in this post will be removed to try and keep the thread a manageable size for both our readers and panellists.

**Answering Questions:**

Please only answer a posted question if you are an expert in the field. [The full guidelines for posting responses in AskScience can be found here](http://www.reddit.com/r/askscience/wiki/index#wiki_answering_askscience). In short, this is a moderated subreddit, and responses which do not meet our quality guidelines will be removed. Remember, peer reviewed sources are always appreciated, and anecdotes are absolutely not appropriate. In general if your answer begins with 'I think', or 'I've heard', then it's not suitable for /r/AskScience.

If you would like to become a member of the AskScience panel, [please refer to the information provided here](https://www.reddit.com/r/askscience/comments/3exo6p/askscience_panel_of_scientists_xiii/).

Past AskAnythingWednesday posts [can be found here](http://www.reddit.com/r/askscience/search?q=flair%3A%27meta%27&restrict_sr=on&sort=new&t=all).

Ask away!",12,https://www.reddit.com/r/askscience/comments/dm0mwr/ask_anything_wednesday_engineering_mathematics/
263,"How wide is the ""space"" that things can orbit earth?","Like for example, a space station. Is there a specific zone a certain distance from Earth it needs to stay to maintain orbit? Or is it a single specific distance?",8,https://www.reddit.com/r/askscience/comments/dm0sxu/how_wide_is_the_space_that_things_can_orbit_earth/
264,"Looking at the night sky and the ‘band’ of our Milky Way galaxy, how can the thousands of other visible starts be part of our galaxy when they are not within the ‘band’, and instead spread out across the sky?","I’ve been struggling to understand this tonight, please enlighten me!",1,https://www.reddit.com/r/askscience/comments/dmag3t/looking_at_the_night_sky_and_the_band_of_our/
265,How does breathing work?,Like how does our respiratory system bring the air in?,5,https://www.reddit.com/r/askscience/comments/dm3ak9/how_does_breathing_work/
266,"Is educational attainment linked to genetics, and if so why?",There was [an article in the Economist today](https://www.economist.com/science-and-technology/2019/10/23/migrants-from-coalfields-take-dna-as-well-as-talent-with-them) that seemed to indicate researchers could tell from a person's genetics whether they had decided to stay or leave a coal mining area. Has there been extensive research to back up the claim that education has a genetic factor?,5,https://www.reddit.com/r/askscience/comments/dm2s7p/is_educational_attainment_linked_to_genetics_and/
267,Where do Astronaut's get their oxygen from in space?,,9,https://www.reddit.com/r/askscience/comments/dm01wz/where_do_astronauts_get_their_oxygen_from_in_space/
268,Why does growing meat add more carbon to the air than plants do?,"Now I understand that at the surface this seems kind of dumb. Cow has to eat plants and is breathing, which adds carbon it's entire life, then gets given to us, instead of plants that absorb carbon that are fed to us. Simple.

But then I was thinking. Wouldn't this process be carbon neutral regardless of whether we eat plants or meat?


In the case of plant, it's a shorter path. Plant absorbs carbon and stores it in mostly carbohydrates. So it's basically taken water, sunlight, and carbon dioxide and used that to store energy in the form of some compounds with carbon, hydrogen, and maybe oxygen (not too sure on the chemistry here, but definitely carbon and hydrogen are there.) Gives off some oxygen in the process. 


Now we eat these molecules, take oxygen, basically combust the molecules and get water, carbon dioxide, and energy as a result. So, carbon from air goes into plant, comes out of our lungs. No carbon was pulled from Earth, no new carbon added to atmosphere. Carbon neutral process. 


Now with meat, the cow does the same thing we did. Of course it stores some of that carbon in fat and proteins, but again, all of the carbon it is comprised of came from the air. Nobody is digging up oil and feeding it to the cow. Then we eat the cow, releasing some of the carbon it didn't. This process is just less efficient, sure, but in my mind still carbon neutral. 


Now there is the methane farts of these cows. But methane is again some carbon and hydrogen. So some bacteria are getting fed too. 


Yet we still hear that meat is much worse for climate change than plants. I don't think this is a false statement yet, but is this simply a logistics issue? As in, the land required to grow the plants came from a forest, the transportation needed, and so on? I want to understand where the new carbon (by this I mean carbon that wasn't in the atmosphere in the last few centuries) is coming into play. 

Thanks in advance for the answers :)",10,https://www.reddit.com/r/askscience/comments/dlyou1/why_does_growing_meat_add_more_carbon_to_the_air/
269,How do geese decide where in the v to fly?,By chance I was under a v of geese long enough on the morning commute (not driving btw) to wach a pair at the back of the v change position with eachother. I was wondering how they choose their position or qhen they know to switch for that matter.,9,https://www.reddit.com/r/askscience/comments/dlxt42/how_do_geese_decide_where_in_the_v_to_fly/
270,why is pure water not conducting electricity due to autoprotolysis?,"Confused high school student here. We've recently covered acids and bases, and the autoprotolysis of water. If some molecules in pure water can become positive hydronium ions and negative hydroxide ions, why do we always conclude that pure water can't conduct electricity? Are these ion concentrations insignificantly small?

Any help is greatly appreciated!",13,https://www.reddit.com/r/askscience/comments/dlwm6j/why_is_pure_water_not_conducting_electricity_due/
271,Does childhood participation in lotteries have any impact on whether or not a person is likely to develop a gambling problem (then or later in life)?,"Current controversy about loot-boxes is computer games is that they are wrong because they prey on children and they are often characterized as a form of gambling (usually when real money is involved).

But is there any scientific knowledge on whether participation in lotteries change gambling tendencies amongst children?",9,https://www.reddit.com/r/askscience/comments/dlweu6/does_childhood_participation_in_lotteries_have/
272,"While heteroparternal superfecundatiom results in twins from different fathers, would it be possible for an ova to be fecundated by two different sperm causing only one child of two fathers?",,1,https://www.reddit.com/r/askscience/comments/dm3o33/while_heteroparternal_superfecundatiom_results_in/
273,"Was there a notable difference in oxygen percentages in ancient human history (like 100,000 yrs ago) vs the ~20.9% of today?","I was talking to someone about atmospheric oxygen levels, algae and land plant life are currently experiencing some issues, and apparently human brains die at around 19.5% oxygen (this part has been dealt with in the comments as incorrect information, thank you) I had mentioned this and they argued that oxygen levels were different before in the past.  
There's been a dip of about 0.06% since 1992 according to oxygen levels records I could find. If that continued it'd take maybe 600-700 years to kill us all. So I'm not that immediately worried. But I cannot find data about percentages from thousands of years ago, assuming human brains require the same amount of oxygen I suspect the percentage was never very close to 19.5%.

The question is; was there a period of time during human history in which oxygen levels were rather different from today?",11,https://www.reddit.com/r/askscience/comments/dlsodz/was_there_a_notable_difference_in_oxygen/
274,Can inaudible sounds damage our hearing?,,12,https://www.reddit.com/r/askscience/comments/dlsn1i/can_inaudible_sounds_damage_our_hearing/
275,Teeth shouldn't be brushed right after drinking cola because acids in it soften the enamel. Does rinsing the mouth with water thoroughly speed up the recovery time (after which teeth can be brushed without inflicting damage)? (and by how much?),,13,https://www.reddit.com/r/askscience/comments/dlsf2q/teeth_shouldnt_be_brushed_right_after_drinking/
276,How is plasma generated? and what is it really?,"I am looking for a more nuanced  answer in truth, what is it specifically about   fast moving molecules that causes ionization?

&#x200B;

my  hypothesis is that the atoms themselves are able to knock out electrons from other atoms  and you  should have some sort of statistical distribution of  ionized and non ionized  particles,  but in a plasma you have mostly ionised particles, is this correct ? , whats the reality?

&#x200B;

also in regards to plasmas  do they lose all of their electrons or just some of their electrons for example does  a plasma  alumininum lose  the outer shell of electrons  or all of them .

&#x200B;

thank you very much to whoever answers",8,https://www.reddit.com/r/askscience/comments/dlt2xh/how_is_plasma_generated_and_what_is_it_really/
277,Does applying current to water affect its refractive index?,I came to know that refraction in the glass is caused by electric fields interacting with the incoming photons. So is it possible to change refractive index of water by applying electric field?,12,https://www.reddit.com/r/askscience/comments/dlrqkd/does_applying_current_to_water_affect_its/
278,Does dissolution affect volume differently than just addition?,"Say I have two glasses of x amount of water. If I add y amount of salt to one and y amount rocks to the other, will both volumes be x+y",16,https://www.reddit.com/r/askscience/comments/dlnjzt/does_dissolution_affect_volume_differently_than/
279,How does Carbamide Peroxide work to whiten teeth?,"Hi, I understand a few basics but I have further questions I was hoping someone could answer:

1) As I understand, CP breaks down to Hydrogen Peroxide. I read online that CP works for ‘longer’ and continues to whiten your teeth for many hours after application. How exactly does this work? Is the CP absorbed into your teeth and continue the bleaching process even after you brush your teeth?

2) Why does CP work longer than HP?

3) Can someone provide some solid reasoning to support or deny the claim that LEDs are effective in teeth whitening? Is the LED supposed to activate the CP faster or simply dry out your teeth so that CP can work faster without interference from your saliva?

4) How much CP at 44% needs to be applied, how often, and for how long for beat results?

5) I have read that CP/HP essentially removes a very thin layer of enamel each time you apply it and leave it on. Does this essentially mean that if you continue to apply it, eventually it will remove enough enamel to become harmful/dangerous? Does CP whiten your teeth by actually penetrating your teeth and bleaching the inside, or by removing a thin layer (this essentially only removing surface stains), or both?

Thank you!",7,https://www.reddit.com/r/askscience/comments/dlptj3/how_does_carbamide_peroxide_work_to_whiten_teeth/
280,What's going on with the prints left behind by the stuffed mushrooms we ate last night?,"Here is an image and a short video
https://imgur.com/gallery/kS9wCJ8

We cooked and ate stuffed mushrooms last night and after getting home from work today, we noticed very strange patterns left behind on the plate.

I have two theories:

1. Some sort of crystalline growth.
2. Some sort of fungus growth

Please someone help me understand!",6,https://www.reddit.com/r/askscience/comments/dlppu3/whats_going_on_with_the_prints_left_behind_by_the/
281,"What makes something ""organic?""",I notice that a lot of companies brag that their food is organic. What's difference between organic and non-organic?,4,https://www.reddit.com/r/askscience/comments/dlpt5j/what_makes_something_organic/
282,What percentage of people living with AIDS contracted it sexually?,"AIDS can be transmitted non-sexually in many ways: needles, bodily fluids, giving birth etc... So, is it common? A chart of the causes of AIDS transmission and their rates would be helpful. Thanks.",6,https://www.reddit.com/r/askscience/comments/dlpm1a/what_percentage_of_people_living_with_aids/
283,"When I see a blurry gas above a bonfire or charcoal grill, what is causing the blurriness? It is colorless and transparent, but makes whatever I see behind it appear blurry in a wavy way. Is it carbon dioxide? Carbon monoxide? H? O? HO?",,4939,https://www.reddit.com/r/askscience/comments/dkyqq5/when_i_see_a_blurry_gas_above_a_bonfire_or/
284,Why are some transition metals compounds soluble and others aren't?,"Why are some transition metals soluble such as Iron (III) Nitrate and other transition metal-nitrates, whereas most transition metals hydroxides, carbonates and chlorides precipitate (such as iron (III) hydroxide, iron (III) chloride, cobalt (II) iodide)?

I have consulted research papers and found no general trend on specifically **why** transition metals are sometimes soluble and sometimes insoluble in water. I believe it is to do with the ability of transition metal compounds to form complexes with the H2O compound, but I might be wrong.

Could someone help point me in a general direction (such as sometime to do with the d-orbitals) or perhaps provide an explanation on why transition metals are sometimes soluble and others not so?

Thank you for taking your time in reading this. Any help would be appreciated.

&#x200B;

Edit: Grammar",1,https://www.reddit.com/r/askscience/comments/dlw019/why_are_some_transition_metals_compounds_soluble/
285,"What is the difference between idolized salt, sea salt, and kosher salt?",,2,https://www.reddit.com/r/askscience/comments/dlrloa/what_is_the_difference_between_idolized_salt_sea/
286,Why do statistics behave differently when identical particles are involved?,"I'm borrowing the example from [this wikipedia article](https://en.wikipedia.org/wiki/Identical_particles#Statistical_properties_of_bosons_and_fermions).  Let's say I have two indistinguishable bosons, each of which can exist in two states, |0> and |1>.  If I put the two particles together in a noisy environment, let them evolve for some time, and then measure their states, I have a 33% probability each of measuring |00>, |01>, or |11>.  This makes sense on some level --- the combined system had three possible states, all of the same energy, and a uniform distribution over those states maximizes entropy.

Obviously, this doesn't generalize to normal macroscopic systems.  If I put two coins in a cup, shake them for a while, and observe their state, I would expect to find two heads with 25% probability, two tails with 25% probability, and 1 heads and one tails with 50% probability.  Of course, macroscopic coins are not indistinguishable, but where exactly does indistinguishably change the statistics so fundamentally?  Is it at the time of observation?  If I observed the state with a sufficiently low-resolution camera, that could resolve heads and tails, but not distinguish the two coins by any markings, would my observations mimic the quantum-mechanical case?  Or is the indistinguishably important while the coins/particles are time-evolving in a noisy environment?

Of course, I know that quantum mechanics are inherently counter-intuitive, and I shouldn't expect my normal intuitions to apply.  However, the classical behavior should be a limiting case of the quantum-mechanical behavior, and I don't see where the boundaries between the classical and quantum-mechanical behavior lies. In principle, could one construct two atom-for-atom identical coins, put them in Schrödinger's box, shake it, and expect two heads with 33% probability?",7,https://www.reddit.com/r/askscience/comments/dlj5hv/why_do_statistics_behave_differently_when/
287,Why always experiment on rats..?,Aren’t they dumb parasites?,0,https://www.reddit.com/r/askscience/comments/dlyvv3/why_always_experiment_on_rats/
288,How does maintaing methane levels influence global heating?,"I best explain. First of all I am a scientist myself, though is slightly outside my comfort zone. I'm hoping a greenhouse gas specialist could answer.

Methane breaksdown over 8-10 years. So lets say that every year we produce exactly the same amount of methane, we get to a state where the methane is being put into the atmosphere at the same rate by which it is breaking down (let's forget about CO2 and other GHGs for now).

If atmoshpheric methane remains constant, will it maintain the current temperatue (pre-industrial +1.5c)? or will it continually have a warming effect, pushing up global temperatures. 

To word it a different away:

Is the impact of methane in the atmosphere mainly from the simple abundance of it. Or is it the abundance of it multiplied by it's time present.

I appreciate it is a bit more nuanced that I am making it, but I hope my question comes across. Please ask if I am not being clear enough.",7,https://www.reddit.com/r/askscience/comments/dlggth/how_does_maintaing_methane_levels_influence/
289,Why can you crumble paper but not fabric?,"When you fold or crumple paper it stays this way and it is really hard to get rid of the folding lines (if even possible).
If you try the same with fabric it does not work and you cannot tell whether a piece of fabric has been folded before or not.

Why is that?

Edit: I misspelled crumple in the title but cannot change it. So the question is about crumpling and not crumbling.",5,https://www.reddit.com/r/askscience/comments/dli6pi/why_can_you_crumble_paper_but_not_fabric/
290,"What is the chemical and biological mechanism that leads to ""instant death"" in cases of solvent abuse?",,6,https://www.reddit.com/r/askscience/comments/dlh74r/what_is_the_chemical_and_biological_mechanism/
291,Do deep sea creatures have a sleep schedule?,,7977,https://www.reddit.com/r/askscience/comments/dkpg6x/do_deep_sea_creatures_have_a_sleep_schedule/
292,Eye lense - help me understand?,"With reference to the lense in an eye.
Why do they say that when the lense is round (versus flat) that the cilliary muscle is relaxed and the syspensory ligament is TIGHT? Surely the cillary muscle becomes longer when relaxed (versus short) when it’s contracted? So that extra length in the muscle should allow the ligament (which is not elastic) to be SLACK( not tight)?",3,https://www.reddit.com/r/askscience/comments/dlgkqy/eye_lense_help_me_understand/
293,Why Do Drugs like Losartan and other ARB's take weeks to have full effect?,"The manuals for Losartan says that while the initial dose will be in effect in 4-6 hours after ingestion, the full effect of the drug will take a few weeks. Why is that?",2,https://www.reddit.com/r/askscience/comments/dlhub5/why_do_drugs_like_losartan_and_other_arbs_take/
294,How exactly is memory stored in our brain?,"I mean like I know it is stored in specific areas of the brain but at the molecular level,how does it ""stay""?",30,https://www.reddit.com/r/askscience/comments/dl4vk6/how_exactly_is_memory_stored_in_our_brain/
295,How come the theory of pangea ultima doesn't go against the theories of entropy?,Why would the continents meet and form one big continent?,0,https://www.reddit.com/r/askscience/comments/dliy5r/how_come_the_theory_of_pangea_ultima_doesnt_go/
296,Do live vaccines grown in human embryos have the potential to affect our DNA?,So I had this anti vaxer in my class bring up that certain live vaccines are propagated in human embryos and that if the embryo has a predisposition to cancer it would be passed to us. My professor isn’t too bright and didn’t know what to reply with. Can someone give me a scientific explanation of why this is not true so that I can at least debate against this person? I know that the virus is replicated. I don’t know whether or not it’s an RNA or DNA virus. If RNA I know it would replicate outside of the nucleus and have no contact with our DNA. Any clarification?,6,https://www.reddit.com/r/askscience/comments/dl7s00/do_live_vaccines_grown_in_human_embryos_have_the/
297,How do we know that earth isn't inside of a nebula?,"Considering that nebulae can streched across hundreds of light years, how did we come to conclusion that we aren't in one?",10,https://www.reddit.com/r/askscience/comments/dl2w7t/how_do_we_know_that_earth_isnt_inside_of_a_nebula/
298,How does spontaneous symmetry breaking explain the Higgs field?,,12,https://www.reddit.com/r/askscience/comments/dl1ae0/how_does_spontaneous_symmetry_breaking_explain/
299,How does the stomach replenish loss of acid?,"When you vomit, and even just through the regular process of digestion the stomach looses some acid, how does it “refill” itself?",10,https://www.reddit.com/r/askscience/comments/dl0iyv/how_does_the_stomach_replenish_loss_of_acid/
