,discussion_topic_title,discussion_topic_message,upvotes,thread_ref_link
0,AskScience Panel of Scientists XXI,"**Please read this entire post carefully and format your application appropriately.**

This post is for new panelist recruitment! The previous one is [here](https://www.reddit.com/r/askscience/comments/amj68a/askscience_panel_of_scientists_xx/).

The panel is an informal group of redditors who are **either professional scientists or those in training to become so**. All panelists have at least a graduate-level familiarity within their declared field of expertise and answer questions from related areas of study. A panelist's expertise is summarized in a color-coded AskScience flair.

Membership in the panel comes with access to a panelist subreddit. It is a place for panelists to interact with each other, voice concerns to the moderators, and where the moderators make announcements to the whole panel. It's a good place to network with people who share your interests!

---

**You are eligible to join the panel if you:**

* Are studying for at least an MSc. or equivalent degree in the sciences, AND,

* Are able to communicate your knowledge of your field at a level accessible to various audiences.


------------------

**Instructions for formatting your panelist application:**

* Choose exactly one general field from the side-bar (Physics, Engineering, Social Sciences, etc.).

* State your specific field in one word or phrase (Neuropathology, Quantum Chemistry, etc.)

* Succinctly describe your particular area of research in a few words (carbon nanotube dielectric properties, myelin sheath degradation in Parkinsons patients, etc.)

* Give us a brief synopsis of your education: are you a research scientist for three decades, or a first-year Ph.D. student?

* Provide links to comments you've made in AskScience which you feel are indicative of your scholarship.  Applications will not be approved without several comments made in /r/AskScience itself.

-----------------

Ideally, these comments should clearly indicate your fluency in the fundamentals of your discipline as well as your expertise. We favor comments that contain citations so we can assess its correctness without specific domain knowledge.

Here's an example application:

       Username: /u/foretopsail
       General field: Anthropology
       Specific field: Maritime Archaeology
       Particular areas of research include historical archaeology, archaeometry, and ship construction. 
       Education: MA in archaeology, researcher for several years.
       Comments: 1, 2, 3, 4.

Please do not give us personally identifiable information and please follow the template. We're not going to do real-life background checks - we're just asking for reddit's best behavior. However, several moderators are tasked with monitoring panelist activity, and your credentials will be checked against the academic content of your posts on a continuing basis.

You can submit your application by replying to this post.",304,https://www.reddit.com/r/askscience/comments/cflsy3/askscience_panel_of_scientists_xxi/
1,AskScience AMA Series: We are researchers studying biological rhythms and we want to 'lock the clock' to permanently end daylight saving time - ask us anything!,"We are from the Society for Research on Biological Rhythms ([SRBR](https://srbr.org/)), an organization of international scientists, clinicians, and industry experts who promote basic and applied research in all aspects of biological rhythms. We are dedicated to advancing rigorous, peer-reviewed science and evidence-based policies related to sleep and circadian biology.

Daylight saving time (DST) in the USA ends this weekend and we support the campaign to permanently end DST for better health. You can read more about this in our position paper titled ""[Why Should We Abolish Daylight Saving Time?](https://journals.sagepub.com/doi/full/10.1177/0748730419854197)"" that was published in the Journal of Biological Rhythms earlier this year.

Our team for today is:

+ [Dr. Laura Kervezee](https://twitter.com/Mind_the_time) - SRBR public outreach fellow & researcher at Leiden University, Netherlands (shift work, circadian disruption and human health)
+ Dr. Allison Brager - Walter Reed Army Institute of Research, Author of Meathead: Unraveling the Athletic Brain (sleep, circadian rhythms and behavioral neuroscience)
+ [Dr. Jonathan Cedernaes](https://twitter.com/jcedernaes) -Northwestern University, Illinois & Uppsala University, Sweden (sleep, circadian rhythms, metabolic disorders)
+ [Dr. Louise Ince](https://twitter.com/LM_Ince) - University of Geneva, Switzerland (circadian rhythms and immune function)
+ [Dr. Emily Manoogian](https://twitter.com/EmilyManoogian) - Salk Institute, California (circadian rhythms, time-restricted eating)
+ [Dr. Céline Vetter](https://twitter.com/DrCelineVetter) - UC Boulder, Colorado (circadian rhythms, sleep, and chronic disease epidemiology)

You can also find us on Twitter at [@SRBR_Outreach](https://twitter.com/SRBR_Outreach).

We will be online at 3pm ET (19 UT) on Friday November 1st to answer your questions. Ask us anything!


---

Thank you to everyone who participated! We were not able to answer every question, but were happy to see so much interest and many insightful questions! For more information, go to our website (srbr.org) or follow us on twitter (@SRBR_Outreach, or any of our individual twitter handles shown above).

Sincerely,

SRBR Outreach

(Laura, Louise, Jonathan, Emily, Allison, and Céline)",8098,https://www.reddit.com/r/askscience/comments/dq2nv3/askscience_ama_series_we_are_researchers_studying/
2,What is the base of a mountain?,"[The Wikipedia article on mountains](https://en.wikipedia.org/wiki/Mountain) says the following:

1. ""The highest mountain on Earth is Mount Everest""
2. ""The bases of mountain islands are below sea level \[...\] Mauna Kea \[...\] is the world's tallest mountain...""
3. ""The highest known mountain on any planet in the Solar System is Olympus Mons on Mars...""

What is the base of a mountain and where is it? Are the bases of all mountains level at 0m? What about Mauna Kea? What is the equivalent level for mountains on other planets and on moons? What do you call the region or volume between the base and peak?",1369,https://www.reddit.com/r/askscience/comments/dqob73/what_is_the_base_of_a_mountain/
3,"Humans use titanium dioxide for so many things, what will happen when we run out of it?","From my research it doesn't seem like it's a renewable resource, at least not at the rate we use it? Aren't we going to run out of it at some point?",160,https://www.reddit.com/r/askscience/comments/dqf3za/humans_use_titanium_dioxide_for_so_many_things/
4,Why does biological matter make good fertilizer?,"Now hear me out. I'm not stupid. I really love learning and I know that when biological matter, like feces, breaks down, it releases alot of chemicals and elements that are good for plants. I also know that most, if not all, life on Earth need these chemicals and stuff to survive. 

My question is why? Why are these chemicals released by our waste and why are they so good for plants and things? 

Basically, I know they need them, but I don't quite understand the exact reasoning.",4,https://www.reddit.com/r/askscience/comments/dqot9q/why_does_biological_matter_make_good_fertilizer/
5,Why do weather reports use relative humidity instead of absolute humidity?,"100% humidity on a hot summer day feels clammy and unpleasant. 100% humidity on a cold winter morning is fine - the air is saturated, but because it's cold it can't hold much moisture. So why not report the absolute amount of moisture in the air? This is what people already understand humidity to mean.",8,https://www.reddit.com/r/askscience/comments/dqktbl/why_do_weather_reports_use_relative_humidity/
6,"Combustion requires heat, oxigen and fuel. With that said, could I put out a fire if I threw fuel, lets say gasoline, that is cold enough?",,52,https://www.reddit.com/r/askscience/comments/dqev3m/combustion_requires_heat_oxigen_and_fuel_with/
7,"When an object absorbs a liquid, is energy lost?","Take a towel for instance. When it absorbs water it moves mass but doesn't appear to generate heat. It also seems to be completely reversible, i.e. you can squeeze the towel enough and have a puddle of water and a dry towel.",31,https://www.reddit.com/r/askscience/comments/dqf2dx/when_an_object_absorbs_a_liquid_is_energy_lost/
8,Why do animal cells die without oxygen?,,0,https://www.reddit.com/r/askscience/comments/dqpfdc/why_do_animal_cells_die_without_oxygen/
9,"when in colonies, how do bats use echolocation without getting confused?","I recently visited a location in Austin, Texas in which 100,000 bats live under a bridge. I could hear all of them squeaking at the same time but was wondering how they can use their echolocation without being confused by other bats squeaks. is there a way they can find their own squeak? 

It seems comparable to trying to distinguish someone's voice in a room full of people talking, but maybe echolocation works completely different. thank you :)",2387,https://www.reddit.com/r/askscience/comments/dpwfrv/when_in_colonies_how_do_bats_use_echolocation/
10,Just how effective is the 12 step program as a treatment for Alcoholism on a purely scientific basis?,,7,https://www.reddit.com/r/askscience/comments/dqgmsu/just_how_effective_is_the_12_step_program_as_a/
11,Does everything in the universe pull on everything else in the universe?,My high school physics teacher told my class that we all pull on everything in the universe. Today I was curious how long it takes for gravity to travel to objects and I looked it up on google and was told that it moves at the speed of light. But I also have been told that space is expanding faster than the speed of light. So I’m wondering if it is true that everything pulls on everything else in the universe?,7,https://www.reddit.com/r/askscience/comments/dqejts/does_everything_in_the_universe_pull_on/
12,Why don’t hotspots in the earths mantle move with the continental plates?,"I’m currently taking a geomorphology class in college and we were talking about plate tectonics. Our professor said that the plates move due convection of magma within the earth. However, hotspots tend to stay in place and cause volcanoes as the plate moves over them. Why are the hotspots not effected by convection?",4,https://www.reddit.com/r/askscience/comments/dqeycd/why_dont_hotspots_in_the_earths_mantle_move_with/
13,Is it ok to harvest wind energy?,"If Saharan dust feeds the Amazon plants, I imagine convection currents play a huge role in ecosystems.
Is it ok to harvest this energy?",5,https://www.reddit.com/r/askscience/comments/dqc82a/is_it_ok_to_harvest_wind_energy/
14,What's the difference between a gas giant like Jupiter and a star?,,3,https://www.reddit.com/r/askscience/comments/dqe9im/whats_the_difference_between_a_gas_giant_like/
15,Is there a connection between PPP and schizophrenia in women? How do therapists determine which diagnosis is correct for a specific woman?,"Basically women tend to develop schizophrenia later than men, in their mid to late 20s. This is also around the time that a lot of women start their family's. How do therapists determine if it is PPP (postpartum psychosis) or schizophrenia (or something else)? Plenty of women with PPD (postpartum depression) don't get diagnosis or treatment until quite a while after they have given birth so I don't think the time frame of the illness is necessarily a reliable indicator of which the woman is suffering from.

Do you think there is a lot of misdiagnosis? How does treatment vary between the two illnesses? If the PPP is resistant to therapy does the diagnosis get changed to schizophrenia? Also if a woman has a history of schizophrenia in her family is she more prone to PPP? 

Have any official studies been conducted into this, and if not what is your opinion?",6,https://www.reddit.com/r/askscience/comments/dqbsy5/is_there_a_connection_between_ppp_and/
16,Are sterile neutrinos responsible for the discrepancies in Hubble constant measurements and are sterile neutrinos and heavy neutrinos the same thing?,"So I was watching PBS Space Time and neutrinos was a topic and the presenter Matt O’Dowd said that physicists have only discovered left handed neutrinos and right handed antineutrinos. Since neutrinos have an incredibly tiny mass compared to other particles, does this mean that sterile neutrinos, which are the opposite of normal neutrinos, are the same thing as heavy neutrinos as they’re opposite so the opposite of a tiny mass particle is a heavy mass particle. Also, I also learnt that the value of the Hubble constant has conflicting data taken from 3 different sources, each being the Cosmic Microwave Background Radiation, the afterglow of the Big Bang, Type 1a Supernovae, when a white dwarf takes matter from a larger star that it in a binary pair with it until it explodes, and Quasars, black holes with extremely bright accretion disks. He said that this shows that, if all the results are taken properly, this shows that the Cosmological Constant is increasing over time. He also said in another video that the cause of this could be unknown physics such as a fast moving particle such as sterile neutrinos. In a third video, he says that if more neutrinos exist, such as the sterile neutrinos, then it’s evidence that the early universe would’ve expanded faster than current observational data assumes. So does this mean that sterile neutrinos are the answer to this discrepancy and if not then what is?",2,https://www.reddit.com/r/askscience/comments/dqenn3/are_sterile_neutrinos_responsible_for_the/
17,Can you harvest the spin energy of an object? Can objects be spun up in 0 gravity to serve as batteries?,"An object that is in motion stays in motion right, so if you were to spin a huge object really fast, and then use a machine to harvest that rotational momentum when energy is needed, could you not spin up an object in space and leave it spinning for as long as you want until you're ready to use its energy? Could spinning objects serve as simple batteries? Is it viable to harvest energy from a spinning object?

I posted this yesterday BTW and got 0 replies. AskScience is dying I think, or maybe just over-moderated. I'd be open to suggestions to alternative boards.",8,https://www.reddit.com/r/askscience/comments/dq7itx/can_you_harvest_the_spin_energy_of_an_object_can/
18,"The universe is expanding, but is it measurable within the scope of a single galaxy?","So from my understanding, the universe is expanding, and the rate of expansion is increasing.  Are we able to observe this expansion on the scale of a single galaxy? Like, is the space in between the stars in the milky way observably expanding? Or is it only visible at a much larger scale? Thanks.",2,https://www.reddit.com/r/askscience/comments/dqdrs6/the_universe_is_expanding_but_is_it_measurable/
19,If transistors are so small (like a few atoms) then how do we build them and put all of them on a CPU?,,26,https://www.reddit.com/r/askscience/comments/dq34fh/if_transistors_are_so_small_like_a_few_atoms_then/
20,Why are some surfaces erasable after use of dry-erase (non-permanent) markers while some are not?,"What gives the surface of an object this quality? (Dry-erase markers being erasable from surface) 
Glossiness? Polarity? I am searching the internet but I can't find a certain answer",3383,https://www.reddit.com/r/askscience/comments/dpko6o/why_are_some_surfaces_erasable_after_use_of/
21,Does a single photon propagate as if it were a thin shell of an expanding sphere? Or as a vector with a single direction?,,9,https://www.reddit.com/r/askscience/comments/dq6hcx/does_a_single_photon_propagate_as_if_it_were_a/
22,"We’ve all got mites on our eyebrows. After we’ve exited the womb, how do they get on us, and where are they before that point?","I know next to nothing about it, but like... are they formed in the womb?? I have no idea. Where do they come from?",3,https://www.reddit.com/r/askscience/comments/dq8wzw/weve_all_got_mites_on_our_eyebrows_after_weve/
23,Is there a transitional phase between limestone and marble?,"Marble is, by my understanding produced geologically by limestone being heated and compressed. Are there any cases in which samples show up somewhat half baked?",4,https://www.reddit.com/r/askscience/comments/dq8wrf/is_there_a_transitional_phase_between_limestone/
24,"Why do rodents (squirrels, mice, etc) seem to twitch often when they move?",,2,https://www.reddit.com/r/askscience/comments/dqawya/why_do_rodents_squirrels_mice_etc_seem_to_twitch/
25,Does an increase in Carbon Dioxide levels cause a decrease in cognitive ability directly or is it because of the subsequent drop in Oxygen levels?,"I watch this video  [https://www.youtube.com/watch?v=1Nh\_vxpycEA&t=285s](https://www.youtube.com/watch?v=1Nh_vxpycEA&t=285s)  by Tom Scott on how 'stale air' which was marked by an increase in CO2 levels caused certain health problems in individuals. Is this directly because of the Carbon Dioxide molecules themselves, or is it because an increase in CO2 levels implies a decrease in O2 levels?",8,https://www.reddit.com/r/askscience/comments/dq58r9/does_an_increase_in_carbon_dioxide_levels_cause_a/
26,"With the advancement of science, technology, medicine, and shelter, humans are living longer. Is this the same for household pets?",I’m assuming their food is getting better too along with medicine.  For example a Great Danes life expectancy is 8-10 years. Has that risen over time / will rise in the future?,6,https://www.reddit.com/r/askscience/comments/dq5srp/with_the_advancement_of_science_technology/
27,"If two black holes colliding can create gravitational waves, can smashing two objects on Earth create smaller waves?",,6,https://www.reddit.com/r/askscience/comments/dq6i87/if_two_black_holes_colliding_can_create/
28,Why VX nerve gas poisoning Is treated with atropine?,"I red that nerve gas poisoning is treated with pralidoxime, diazepam and atropine subministration. Wasn't atropine the main active alkloid in Datura stramonium? The one that causes hallucinations, spasms and paralysis? Why would you give something that paralize to a paralized patient? How does It works?",0,https://www.reddit.com/r/askscience/comments/dqbd8c/why_vx_nerve_gas_poisoning_is_treated_with/
29,"In theory, could our blood flow in a constant stream as opposed to at the rhythm the heart pumps it at? If it is possible what would be the advantages and disadvantages of this?",Our heart pumps blood in a rhythm so that every once in a while the body gets a pulse of blood. Would it be possible to replace the heart with a pump that sends a constant stream of blood into our body instead of pumping it out in phases?,1,https://www.reddit.com/r/askscience/comments/dqb7jc/in_theory_could_our_blood_flow_in_a_constant/
30,"What, scientifically, makes hills suboptimal locations for farming?","When I read about history, it seems clear that hills are not very good for farming compared to flat land. Especially in Europe, hills and mountains seem to be reserved for tribes or poor populations who were not wealthy or powerful enough to occupy better farmable land for themselves.


I tried searching on Google about what exactly makes uneven land so bad for farming, but all I found were articles about modern hill farming and terrace farms, none of which really answers what I want to know.


So in short, what physical characteristics of hills makes them bad for farming crops? Does this apply to all crops, or just the most profitable types? Does it have to do with uneven sunlight, bad soil, rocks, water flow...?",2,https://www.reddit.com/r/askscience/comments/dqaw60/what_scientifically_makes_hills_suboptimal/
31,"When millipedes walk, does their wavelength of motion depend on size/individual? Is there a benefit to shorter/longer wavelength?","Hi,

I saw [this](https://www.reddit.com/r/oddlysatisfying/comments/dpuvfw/flame_leg_millipede_walking_pattern/?utm_source=share&utm_medium=ios_app&utm_name=iossmf) post on the front page of a millipede walking and saw that it has a pretty much constant wavelength to the motion of his legs.

I was wondering why would it use that specific one? Does it depend on length or number of legs? Do all millipedes use the same wavelength?

Would using a shorter one mean walking faster?

Thanks!",14,https://www.reddit.com/r/askscience/comments/dq0rkn/when_millipedes_walk_does_their_wavelength_of/
32,How do scientists account for differences in time when analyzing the interaction between celestial bodies?,"When a scientist looks through a telescope, no matter what type it is, they aren't seeing a current snapshot of anything. The light from the objects that are observed are arriving at different times depending on how far away the object is. Since these objects are all out of sync, how do astronomers and cosmologists make predictions about how the objects are interacting with each other when its impossible to view them together in the same time? How do they account for this when making predictions about things like gravitational influence, etc.?",2,https://www.reddit.com/r/askscience/comments/dq6y63/how_do_scientists_account_for_differences_in_time/
33,How do medicines/painkillers know which body part to target?,"For example, Azo is an over the counter UTI painkiller. How does the drug “know” to target the urinary track? Like I’m guessing the medicine dissolves in the stomach, so how does it not affect anything until it reaches its target?",1,https://www.reddit.com/r/askscience/comments/dq8ku5/how_do_medicinespainkillers_know_which_body_part/
34,Why Einstein Rings are blue?,,5,https://www.reddit.com/r/askscience/comments/dq0o68/why_einstein_rings_are_blue/
35,How Exactly Does Prion Disease Kill?,My friends and I were talking about cannibalism the other day and Kuru came up. I've looked around and haven't found anything that plainly states how exactly the disease kills. Same with Mad Cow. I know prion disease is the prion converting normal proteins into prions but why exactly is that lethal? What does that do?,27,https://www.reddit.com/r/askscience/comments/dpuzo9/how_exactly_does_prion_disease_kill/
36,Do whales and sharks have buttholes?,"I would think whales have buttholes because they’re mammals. Is this true? Also, sharks aren’t mammals, so do they have buttholes?",0,https://www.reddit.com/r/askscience/comments/dqcsk5/do_whales_and_sharks_have_buttholes/
37,What makes an electron or proton negatively or positively charged? What defines that?,"I just had science class today, and we are talking about the inner workings of atoms, and I couldn't get this question out of my head.",16,https://www.reddit.com/r/askscience/comments/dpu7s8/what_makes_an_electron_or_proton_negatively_or/
38,Why do you float to the surface despite when deep in the sea there is a great pressure on you?,,4,https://www.reddit.com/r/askscience/comments/dpx1ii/why_do_you_float_to_the_surface_despite_when_deep/
39,Is anything described by the Schrodinger equation besides quantum mechanics?,"The wave equation shows up in a zillion different places. So does the heat equation. Try finding something that spring equations *aren't* useful for approximating. Same for almost everything I learned in my physics degree, with the conspicuous absence of the Schrodinger equation, but I'd expect that's just my ignorance showing. Are there any neat examples of systems outside QM that can be described by the Schrodinger equation? Or other things that can be quantized in analogous ways?

------

edit: I should say I'm curious about applications *outside of physics*, like how heat and wave equations show up in places like traffic and population dynamics and stock market modeling, and even hamiltonian dynamics aren't limited to being useful only for physical systems.",6,https://www.reddit.com/r/askscience/comments/dpwxix/is_anything_described_by_the_schrodinger_equation/
40,How did the southern United States accent come to be?,"The southern accent in the United States is very distinctive. How did it come to exist, and for that matter any of the other strong regional accents, like New York and Boston?",13,https://www.reddit.com/r/askscience/comments/dpsdvf/how_did_the_southern_united_states_accent_come_to/
41,Why does a standing wave appear in this rope?,"It appears not the be the Mould effect, and is different than the fountain effect. 
[rope standing wave](https://thumbs.gfycat.com/JitterySnarlingBanteng-mobile.mp4) Especially towards the end of the video",6,https://www.reddit.com/r/askscience/comments/dpwvf7/why_does_a_standing_wave_appear_in_this_rope/
42,[Medicine] Why do mechanically stressed podocytes have increased glucose uptake?,"I'm having a hard time explaining this line: 

""In mechanically stressed podocytes, glucose uptake increased 2-fold in the LG and NG groups but increased 3-fold in the HG group.""

Why does this happen? Or does further research need to be done to understand this mechanism

 [https://www.ncbi.nlm.nih.gov/pubmed/15673689](https://www.ncbi.nlm.nih.gov/pubmed/15673689)",4,https://www.reddit.com/r/askscience/comments/dpwkef/medicine_why_do_mechanically_stressed_podocytes/
43,How have fish adapted to fishing?,Is there any evidence of selection for those who don’t eat certain bait? Maybe they’re more skiddish?,11,https://www.reddit.com/r/askscience/comments/dpsvn0/how_have_fish_adapted_to_fishing/
