,discussion_topic_title,discussion_topic_message,upvotes,thread_ref_link
710,How is our diet today different (in terms of macronutrient percentages) than thousands of years ago?,"Today, in general most of our diet comes from carbohydrates. Following that, fat % and protien % are pretty interchangeable depending on diet.

I couldn't find an accurate source for the average amount of macros a man/woman eats, but I found this quote that seemed pretty close to what I imagine it is, and what I learned from in health class (If someone knows a source please link it.

["" Adults should get 45 percent to 65 percent of their calories from carbohydrates, 20 percent to 35 percent from fat, and 10 to 35 percent from protein ""](http://www.nationalacademies.org/hmd/Reports/2002/Dietary-Reference-Intakes-for-Energy-Carbohydrate-Fiber-Fat-Fatty-Acids-Cholesterol-Protein-and-Amino-Acids.aspx)  


I can't help but think that compared to thousands of years ago, there's so much mass-produces carbohydrates found everywhere like rice, bread, pastries, desserts, pasta, etc. Back when humans were primitive and there wasn't much as much mass-production of food, what would you think their average macros would be? I would imagine it would be fairly high in protein and fat (animal fat mind you) and moderately low carbs (from fruits)",5,https://www.reddit.com/r/askscience/comments/dderqw/how_is_our_diet_today_different_in_terms_of/
711,How do acids and bases work when they contact skin? Why are they so dangerous?,Im studying titrations and molarity right now in ap chemistry and we are doing a copper to copper lab. We were all warned of the dangers of sodium hydroxide and nitric acid and that got me thinking about what actually causes the damage. I know acids give up h+ molecules in water does this cause a reaction with water on your skin? Or am I totally off?,5,https://www.reddit.com/r/askscience/comments/ddeghx/how_do_acids_and_bases_work_when_they_contact/
712,Can a hermaphrodite fertilize himself/herself?,"Hey, 

I just wondered if it's technically possible for a hermaphrodite to fertilize himself/herself if both sexual organs male & female are fully developed.

And above all: would the child be a clone?!",4,https://www.reddit.com/r/askscience/comments/ddfis8/can_a_hermaphrodite_fertilize_himselfherself/
713,What are these chemical compounds found in hemp distillate?,"Hi Science,

I have a question from the hemp/CBD community (originally posted with photo [here](https://www.reddit.com/r/CBDhempBuds/comments/dd6tti/labs_from_a_popular_vendor_what_does_the_text_in/?utm_source=share&amp;amp;utm_medium=ios_app&amp;amp;utm_name=iossmf) in r/CBDhempbuds). 

Lab results of a hemp distillate product from a popular CBD vendor shows the following “Tentatively Identified Compounds: Peak 1: Hit 1: Bicyclo[5.2.0]Nonane, 4-Ethenyl-4,8,8-Trimethyl-2-Methylene-.” As I understand, tentatively identified compounds are other compounds a test picks up that it wasn’t necessarily looking for. What are these compounds, where (if anywhere) are they found in nature, and are they dangerous?

Thank you!",3,https://www.reddit.com/r/askscience/comments/ddfe4i/what_are_these_chemical_compounds_found_in_hemp/
714,What would happen to mud if it was heated at a very high temperature? Does it react the same as clay?,"Would it react in the same way as clay, or would it turn back into mud after being reintroduced to water? What would the temperature be needed to almost instantly remove the moisture of say a muddy surface? 

Thanks!",1,https://www.reddit.com/r/askscience/comments/ddibbz/what_would_happen_to_mud_if_it_was_heated_at_a/
715,"How evenly does CO2 spread out in the atmosphere, and are there regions were the level is a a significantly higher levels?",,11,https://www.reddit.com/r/askscience/comments/dd6hz8/how_evenly_does_co2_spread_out_in_the_atmosphere/
716,"What is the exact biochemistry behind nerve agents, and what process do they carry out in the neurons?",,1,https://www.reddit.com/r/askscience/comments/ddgrg8/what_is_the_exact_biochemistry_behind_nerve/
717,"When discussing properties of sound, is attack and decay included in the construct of timbre/quality?",,5,https://www.reddit.com/r/askscience/comments/dd6l3d/when_discussing_properties_of_sound_is_attack_and/
718,"How earthquakes affect rivers, how drastic can be the change in the flow and the structure of a river ? Are there some interesting examples recorded of river changing after an earthquake? Or maybe there are examples of a river going of its original course for large distances after an earthquake?",,9,https://www.reddit.com/r/askscience/comments/dd61zw/how_earthquakes_affect_rivers_how_drastic_can_be/
719,How does a cell check its DNA during cell checkpoints? What DNA does the cell check its own DNA against?,Does a cell check its own DNA against that of its neighbors? Or perhaps the cell that it was made from?,4,https://www.reddit.com/r/askscience/comments/dd6o3m/how_does_a_cell_check_its_dna_during_cell/
720,Can stress and anxiety increase body temperature?,,9,https://www.reddit.com/r/askscience/comments/dd588h/can_stress_and_anxiety_increase_body_temperature/
721,Where does the flap-flap sound of a helicopter come from? Do all helicopters sound the same?,"Sometimes  helicopters have a rhythmic sound sometimes a swooshing.

 Where does the  rhythm come from?   
It seems to be way slower than the rotation speed.

 What causes the sounds? Are there more silent helicopters?",6,https://www.reddit.com/r/askscience/comments/dd5zza/where_does_the_flapflap_sound_of_a_helicopter/
722,Chemical analysis before 1973?,"Hey all, I’ve been doing some reading on the Ames test that popped up in the 1970s, but can’t seem to find any information as to how chemicals were tested before that.

Also, in the research articles I’ve looked at they’ve mentioned that ‘several’ bacterium are used in Ames testing, but I haven’t found anything other than E. Coli and Salmonella.

Any information on either of these two topics would be greatly appreciated.",4,https://www.reddit.com/r/askscience/comments/dd6ibt/chemical_analysis_before_1973/
723,"How, exactly, is electricity and magnetism related?","We'r cal it electromagnetism, right? So through what medium are they related? Electric current creates a magnetic field around it right? How? Why?",16,https://www.reddit.com/r/askscience/comments/dd2jk3/how_exactly_is_electricity_and_magnetism_related/
724,"Is the olfactory system more active in a monkey than in a human, relatively speaking?","I've learned that a larger percentage of the brain in monkeys - and I guess, other ""less complex animals"" (I dislike that term) as well - is dedicated to the sense of smelling, than in humans. Hence my question, title.

Is this a reasonable conclusion to draw? Thanks.",6,https://www.reddit.com/r/askscience/comments/dd4dpg/is_the_olfactory_system_more_active_in_a_monkey/
725,Does violent media affect how people affect how people react to real world violence?,Basically what the title says. Have there been any studies on how media affects how people react when exposed to real world violence/combat situations/any other kind of traumatic experience that they could have been exposed to in the aforementioned media?,4,https://www.reddit.com/r/askscience/comments/dd51es/does_violent_media_affect_how_people_affect_how/
726,How did we measure the mass of the Dwarf Planet Eris?,"I found online that we were able to discern the mass based off of it's moon Dysnomia's Orbit, but how do we get a measurement within a 2% margin of error without either flying out a probe to test, or knowing the mass of one of the celestial bodies?",8,https://www.reddit.com/r/askscience/comments/dd2pjz/how_did_we_measure_the_mass_of_the_dwarf_planet/
727,"How do we know how many isotopes exist in the universe for an element, and their percentages, to determine the atomic mass? As we discover new isotopes, does a printed periodic table become obsolete because that element will have a new atomic mass?","I've seen two chemistry teachers explain atomic mass by saying it's a calculated average of all the isotopes in the universe and their available percentages. What I can't figure out, even by Googling, is how we know the specific percentages of abundance for these isotopes? 

For example, Chlorine, has a natural abundance of 76% Cl-35, 24% Cl-37, and trace amounts of Cl-36. How'd we get those percentages?",9,https://www.reddit.com/r/askscience/comments/dczkhp/how_do_we_know_how_many_isotopes_exist_in_the/
728,Where does the energy in synchrotron radiation come from?,"If I have a permanent magnet and a beam of electrons passing by it the electrons will be accelerated and thus emit radiation. This radiation obviously contains energy so some other part of the system must lose energy.  
But the electrons are accelerated radially so they shouldn't lose any kinetic energy. Does it come from the magnet?  If so, how?  Would it get weaker over time?",3,https://www.reddit.com/r/askscience/comments/dd2lq0/where_does_the_energy_in_synchrotron_radiation/
729,What plesiomorphic (ancestral) traits of our common ancestor have humans retained but chimpanzees and bonobos have lost?,,4001,https://www.reddit.com/r/askscience/comments/dcbno5/what_plesiomorphic_ancestral_traits_of_our_common/
730,"If matter cannot be crated or destroyed, than how does anything exist?","Sorry if this is a stupid question, it’s just really confusing me.",2,https://www.reddit.com/r/askscience/comments/dd2pl0/if_matter_cannot_be_crated_or_destroyed_than_how/
731,Why can't we solve for the wave function of another element than hydrogen?,,7,https://www.reddit.com/r/askscience/comments/dcww60/why_cant_we_solve_for_the_wave_function_of/
732,Why do prunes have more sorbitol than plums?,,5,https://www.reddit.com/r/askscience/comments/dd06vq/why_do_prunes_have_more_sorbitol_than_plums/
733,"Is there a theoretical limit to how large a star could be, and what are the limiting factors? What about black holes?",,160,https://www.reddit.com/r/askscience/comments/dcm2n3/is_there_a_theoretical_limit_to_how_large_a_star/
734,How do we realistically measure distances to stars outside of the milky way and how do we prove universal expansion?,"I understand the parallax method, but how can that be trusted when we don't know the speeds of the objects we measure or the speeds of the objects we are measuring against. I also know the speed we orbit our Galaxy, and the speed we orbit the sun. I dismiss the speed of Earth's rotation for the sake of the question and I also dismiss the fact that orbits aren't round but rather more like a spirograph. How do we measure distance to a star with any kind of accuracy whatsoever, when were moving so fast inside of two different systems, and we don't know the speed the Galaxy it's in is moving, or it's rotational speed, no do we know the speed that star is orbiting it's Galaxy? Please help me understand this.",56,https://www.reddit.com/r/askscience/comments/dcntsa/how_do_we_realistically_measure_distances_to/
735,When electrons leap from one orbit to the next are they in between orbits ?,"Electrons can only move around certain orbits around a nucleus. If they are agitated (or the opposite) they leap from one orbit to another.  

When they move from one orbit to the next to the neutrons exist between orbits while they move? Or do they pop out from one orbit and reappear at the next without moving through space ?",30,https://www.reddit.com/r/askscience/comments/dcjej4/when_electrons_leap_from_one_orbit_to_the_next/
736,"In a desert, what is under all of the sand?","I've always wondered, in stereotypical deserts with plentiful sand dunes, how deep does the sand go? And what's under the sand? Water? Dirt? Stone?",9848,https://www.reddit.com/r/askscience/comments/dbxuup/in_a_desert_what_is_under_all_of_the_sand/
737,How exactly does a medically induced coma aid recovery?,"Assuming it’s just to let the body ‘heal itself’, why not just go with standard bed rest? Or is it that it allows for more procedures to be done without weeks of bedrest between them?",15,https://www.reddit.com/r/askscience/comments/dclpxb/how_exactly_does_a_medically_induced_coma_aid/
738,"If albino plants usually die from lack of chlorophyll, then how does the Caladium plant survive with white leaves?",,7,https://www.reddit.com/r/askscience/comments/dclzrz/if_albino_plants_usually_die_from_lack_of/
739,Does density of a substance change discontinuously at its melting point?,"Does the density as a function of temperature for a pure substance change discontinuously at its melting point? Or does it merely change very fast but nonetheless continuously. 

&#x200B;

For example, wikipedia says that mercury changes from a solid density of 13.69 g/cm\^3 to a liquid density of 14.184 g/cm\^3 at its melting point of -38.83 degrees C ([https://en.wikipedia.org/wiki/Mercury\_(element)](https://en.wikipedia.org/wiki/Mercury_(element))). But if I had a super precise heat control that could let me control the temperature down to hundredths of a mK if necessary (and plenty of time to let the sample fully equilibrate), could I get a mercury sample of, say, 13.9 g/cm\^3?

&#x200B;

I had always thought of density as changing discontinuously during melting, but I realize now that at least some other phase change properties are not totally discontinuous even when we may think of them that way. Electrical resistance, for instance, is not totally discontinuous when undergoing a superconductivity phase change, but instead transitions rapidly over a few mK. This is even the basis of very sensitive thermometers called ""Transition Edge Sensors (TES)"" ([http://web.mit.edu/figueroagroup/ucal/ucal\_tes/](http://web.mit.edu/figueroagroup/ucal/ucal_tes/)).  See especially the figure [http://web.mit.edu/figueroagroup/ucal/ucal\_tes/files/page14\_1.png](http://web.mit.edu/figueroagroup/ucal/ucal_tes/files/page14_1.png)

&#x200B;

So does density during melting behave like electrical resistance during super conductivity transition (IE changing fast but nonetheless continuously with temperature)? Or is it truly discontinuous, with no possibility of achieving a density between the two transition values, regardless of how finely one can control the temperature?",10,https://www.reddit.com/r/askscience/comments/dcip7d/does_density_of_a_substance_change/
740,Does technology inflame our political polarization?,"With technological advancement comes increased complexity. Does ones availability to information increase confirmation bias, therefore, leading to amplified polarization of beliefs, values, and mores? Especially evident in today’s politics, where it seems more and more difficult for people to compromise.",30,https://www.reddit.com/r/askscience/comments/dcd1n9/does_technology_inflame_our_political_polarization/
741,What's actually in space?,Are there anything in the so called empty space if interplanetary or interstellar space? If so what is it and how did it get there?,5,https://www.reddit.com/r/askscience/comments/dckgwe/whats_actually_in_space/
742,Can we remove too much carbon from the atmosphere?,"Imagine an alternate universe where we are just as technologically advanced as we are now. The only difference is that we are kind of 'reset' at a normal level of carbon in the atmosphere. We discover a new technology that actually removes carbon from the atmosphere. Being how are, we use it veraciously across the entire globe.

Is it possible to have kind-of the opposite problem we have now where too much carbon is being removed from instead of added into the atmosphere? If so, what would be happening to our planet if we did remove large amounts of carbon and put us in a net negative from 'normal'?",2,https://www.reddit.com/r/askscience/comments/dckh0q/can_we_remove_too_much_carbon_from_the_atmosphere/
743,"Besides Proving the Existence of Gravitational Waves, What New Information Have We Learned from LIGO/Virgo?","For example, have we learned about  upper or lower mass limits for black holes or neutron stars?",4,https://www.reddit.com/r/askscience/comments/dckbzh/besides_proving_the_existence_of_gravitational/
744,Does the orientation of the rotation the accretion disk in a Super Massive black hole match the orientation of the spin of the galaxy itself? And in case of quasars?,,10,https://www.reddit.com/r/askscience/comments/dceyiv/does_the_orientation_of_the_rotation_the/
745,To what degree does the pronunciation of a word determine it's potential obscenity/slur-ability?,"The average word is just about as exciting as the dictionary makes it out to be, while a chosen few are singularly responsible for generations of smack-downs, tears, persuasion and death--since they came to be. 

Just say it. ""Fuck.""  It's one of life's real treasures. 

Is it because it physically feels good to say? Do the rules change depending on the language?",7,https://www.reddit.com/r/askscience/comments/dch4my/to_what_degree_does_the_pronunciation_of_a_word/
746,How do nails & hair grow?,Is it like very very slow overtime or is it like a bit at once every time interval,5,https://www.reddit.com/r/askscience/comments/dcix6m/how_do_nails_hair_grow/
747,What is a good spectrum/signal/noise analyzer program that can allow me to view baseband/signal files or stream from a reciever?,"I have looked for a while to find good software for this but I can not seem to find what I am looking for.

I am looking for something that will let me upload a baseband/noise and allow me to zoom into each signal to identify,   
 measurements, etc...

I will be viewing anything from ELH to EHF or higher, looking at a scatterplot, changing powers, etc...

Free software is a big plus but paid is also good.

Any suggestions?",2,https://www.reddit.com/r/askscience/comments/dcl5nv/what_is_a_good_spectrumsignalnoise_analyzer/
748,Is there a relationship between how many babies are born to a member of a species and their chance of living to reproductive age?,I remember hearing that the less likely an animal is to make it to age of reproduction the more babies are born to a female of that species. However I’ve been unable to find information on this since I heard it. Is this true?,4,https://www.reddit.com/r/askscience/comments/dcgcna/is_there_a_relationship_between_how_many_babies/
749,How does the human muscle grow?,I know lifting weights is the obvious answer. I'm asking on a molecular level (sorry if that's wrong wording not very smart with science)? What is going on inside of the muscle itself to make it start it's growing process?,3,https://www.reddit.com/r/askscience/comments/dciwh8/how_does_the_human_muscle_grow/
750,Is it possible to have a non-gaseous planet with permanent storms like Jupiter? And what would the conditions have to be for that to happen?,,15,https://www.reddit.com/r/askscience/comments/dcb6in/is_it_possible_to_have_a_nongaseous_planet_with/
751,Why do Iron fillings highlight the field lines of a magnet?,"I understand that there is a magnetic field surrounding a bar magnet and they  make a torus shape. And that the iron filings are showing that when we sprinkle them over the top. 

But why do the iron filings display them as lines? I thought they would be a somewhat smooth distribution. 

Is it some sort of frictional mechanism with the filings and the paper maybe?",7,https://www.reddit.com/r/askscience/comments/dcfkum/why_do_iron_fillings_highlight_the_field_lines_of/
752,"Were there more forests in Western Texas, Nevada, and Arizona before Europeans arrived, or has the landscape stayed pretty much the same?",,6,https://www.reddit.com/r/askscience/comments/dcelov/were_there_more_forests_in_western_texas_nevada/
753,Why is freshwater **usually** darker than saltwater?,"Is it the salt? Does it depend on the specific molecules? 

^^i ^^hope ^^i ^^flaired ^^this ^^right",2,https://www.reddit.com/r/askscience/comments/dcjf61/why_is_freshwater_usually_darker_than_saltwater/
754,Is glucose just naturally damaging? Why is high blood sugar bad? Can normal people have blood sugar issues?," I've done a little reading about diabetes and it got me asking some questions. It seems like there's a consensus that high blood glucose levels damage your body. Does glucose always cause damage? Is there a level below which glucose doesn't cause damage? Is it more of an optimum level where you have a trade off between damage and body energy (which obviously affects tons of things)? Can spikes in non diabetic people, from drinking a bunch of soda for example, cause small amounts of damage?",9,https://www.reddit.com/r/askscience/comments/dcbjx3/is_glucose_just_naturally_damaging_why_is_high/
755,"Ask Anything Wednesday - Biology, Chemistry, Neuroscience, Medicine, Psychology","Welcome to our weekly feature, Ask Anything Wednesday - this week we are focusing on **Biology, Chemistry, Neuroscience, Medicine, Psychology**

Do you have a question within these topics you weren't sure was worth submitting? Is something a bit too speculative for a typical /r/AskScience post? No question is too big or small for AAW. In this thread you can ask any science-related question! Things like: ""What would happen if..."", ""How will the future..."", ""If all the rules for 'X' were different..."", ""Why does my..."".

**Asking Questions:**

Please post your question as a top-level response to this, and our team of panellists will be here to answer and discuss your questions.

The other topic areas will appear in future Ask Anything Wednesdays, so if you have other questions not covered by this weeks theme please either hold on to it until those topics come around, or go and post over in our sister subreddit /r/AskScienceDiscussion , where every day is Ask Anything Wednesday! Off-theme questions in this post will be removed to try and keep the thread a manageable size for both our readers and panellists.

**Answering Questions:**

Please only answer a posted question if you are an expert in the field. [The full guidelines for posting responses in AskScience can be found here](http://www.reddit.com/r/askscience/wiki/index#wiki_answering_askscience). In short, this is a moderated subreddit, and responses which do not meet our quality guidelines will be removed. Remember, peer reviewed sources are always appreciated, and anecdotes are absolutely not appropriate. In general if your answer begins with 'I think', or 'I've heard', then it's not suitable for /r/AskScience.

If you would like to become a member of the AskScience panel, [please refer to the information provided here](https://www.reddit.com/r/askscience/comments/3exo6p/askscience_panel_of_scientists_xiii/).

Past AskAnythingWednesday posts [can be found here](http://www.reddit.com/r/askscience/search?q=flair%3A%27meta%27&restrict_sr=on&sort=new&t=all).

Ask away!",12,https://www.reddit.com/r/askscience/comments/dcbho8/ask_anything_wednesday_biology_chemistry/
756,Would a sodium ion have the same properties when in an ionic compound and just by itself?,"So because ionic bond is caused by the oppositely charged particles attracting, does this mean that in an ionic compound all the ions would still retain their original ionic properties?",3,https://www.reddit.com/r/askscience/comments/dch3zy/would_a_sodium_ion_have_the_same_properties_when/
757,How do you measure impact absorbance of a liquid?,Measuring the impact absorbance of a solid is straight forward with something like a drop ball test. But how would you measure that for a liquid as the drop ball test won’t work due to the ball being stuck in the liquid?,1,https://www.reddit.com/r/askscience/comments/dcl5en/how_do_you_measure_impact_absorbance_of_a_liquid/
758,"What is the biomechanical significance of ""bird hips"" in dinosaurs?","It's my understanding that the dinosaur clade is grouped together by their hip-bone structure which is similar to modern day birds. This seems a bit odd since dinosaurs probably did a bit more walking and running than most species of bird. The only exceptions would be ostriches, cassowaries, and extinct terror birds. Even then they were bipedal which is characteristic of only a segment of dinosaur species. What made this trait so significant it endured millions of years of natural selection?",6,https://www.reddit.com/r/askscience/comments/dcd3x5/what_is_the_biomechanical_significance_of_bird/
759,How does reading ability vary among typical literate adults?,"Not talking about any varieties of alexia or dyslexia.  For the general population, do we all read at exactly the same speed? If not, what accounts for the difference? Is it just a matter of being taught in the right way? Reading more, as practice?",2,https://www.reddit.com/r/askscience/comments/dcfb8m/how_does_reading_ability_vary_among_typical/
760,Why is the allergic response different than the immune response?,"In my physiology class, like most classes, we're learning that the allergic response is a hypersensitive response to nonpathogenic antigens. We learn about it as a facet of the immune system. But if it's the immune system? Why isn't it a normal immune response? If it's only for nonpathogens, why is there a response at all?  


The symptoms are so different, I can't tell why the allergic response exists at all--it doesn't actually seem to do anything to support the goals of the immune system.",3,https://www.reddit.com/r/askscience/comments/dccgbz/why_is_the_allergic_response_different_than_the/
761,How was the dot product for 4-vectors in Minkowski space derived?,"I've asked my TAs and they say that the (+---) metric comes from the fact that c remains the same in all reference frames, but I'm not sure where to follow from that both mathematically and with a scientific explanation.",1,https://www.reddit.com/r/askscience/comments/dcjeho/how_was_the_dot_product_for_4vectors_in_minkowski/
